{
  "is_error": false,
  "duration_api_ms": 0,
  "num_turns": 2,
  "stop_reason": "tool_use",
  "session_id": "00000000-0000-4000-8000-000000000003",
  "total_cost_usd": 0.0,
  "usage": {
    "input_tokens": 0,
    "cache_creation_input_tokens": 0,
    "cache_read_input_tokens": 0,
    "output_tokens": 0,
    "server_tool_use": {
      "web_search_requests": 0,
      "web_fetch_requests": 0
    },
    "service_tier": "standard",
    "cache_creation": {
      "ephemeral_1h_input_tokens": 0,
      "ephemeral_5m_input_tokens": 0
    },
    "inference_geo": "not_available",
    "iterations": [
      {
        "input_tokens": 0,
        "output_tokens": 0,
        "cache_read_input_tokens": 0,
        "cache_creation_input_tokens": 0,
        "cache_creation": {
          "ephemeral_5m_input_tokens": 0,
          "ephemeral_1h_input_tokens": 0
        },
        "type": "message"
      }
    ],
    "speed": "standard"
  },
  "modelUsage": {
    "neutral-routing-model": {
      "inputTokens": 0,
      "outputTokens": 0,
      "cacheReadInputTokens": 0,
      "cacheCreationInputTokens": 0,
      "webSearchRequests": 0,
      "costUSD": 0.0,
      "contextWindow": 1,
      "maxOutputTokens": 1,
      "canonicalModel": "neutral-routing-model",
      "provider": "firstParty"
    },
    "neutral-primary-model": {
      "inputTokens": 0,
      "outputTokens": 0,
      "cacheReadInputTokens": 0,
      "cacheCreationInputTokens": 0,
      "webSearchRequests": 0,
      "costUSD": 0.0,
      "contextWindow": 1,
      "maxOutputTokens": 1,
      "canonicalModel": "neutral-primary-model",
      "provider": "firstParty"
    }
  },
  "permission_denials": [],
  "terminal_reason": "completed",
  "fast_mode_state": "off",
  "fast_mode_disabled_reason": "neutral_disabled_reason",
  "subtype": "success",
  "api_error_status": null,
  "result": "{\"edits\":[{\"candidate_id\":\"generic-smoothing-1\",\"replacement\":\"\"}]}",
  "structured_output": {
    "edits": [
      {
        "candidate_id": "generic-smoothing-1",
        "replacement": ""
      }
    ]
  },
  "ttft_ms": 0,
  "ttft_stream_ms": 0,
  "time_to_request_ms": 0,
  "type": "result",
  "duration_ms": 0,
  "uuid": "00000000-0000-4000-8000-000000000004"
}
